{
	"definitions": {
		"humanReadableDescription": {
			"type": "array",
			"description": "Array of localized textual descriptions.",
			"format": "tabs",
			"items": {
				"type": "object",
				"title": "Textual Description",
				"headerTemplate": "Locale ({{ self.locale }}) ",
				"options": {
					"collapsed": false
				},
				"properties": {
					"locale": {
						"type": "string",
						"description": "Language used in textual description, in ISO 639-1 format.",
						"watch": {
							"possible_langs": "root.language"
						},
						"enumSource": "possible_langs"
					},
					"description": {
						"type": "string",
						"description": "Textual description of the Service in specified language.",
						"format": "textarea"
					},
					"keywords": {
						"type": "array",
						"title": "Keywords",
						"description": "Keyword tags related to textual description.",
						"uniqueItems": true,
						"format": "select",
						"options": {
							"tags": true
						},
						"items": {
							"type": "string",
							"title": "Tag",
							"id": "arr_item"
						}
					}
				},
				"required": [
					"locale",
					"description"
				]
			}
		}
	},
	"title": "ServiceEntry",
	"$schema": "http://json-schema.org/draft-07/schema#",
	"$id": "http://example.com/root.json",
	"type": "object",
	"required": [
		"serviceId",
		"name",
		"createdByUserId",
		"serviceDescriptionVersion",
		"supportedProfiles",
		"type",
		"thematicArea",
		"language",
		"hasCompetentAuthority",
		"humanReadableDescription",
		"serviceInstance",
		"isDescribedAt",
		"processingBases",
		"role"
	],
	"format": "categories",
	"properties": {
		"serviceId": {
			"type": "string",
			"title": "Service ID",
			"default": "",
			"description": "Unique ID for the service.",
			"minLength": 3
		},
		"name": {
			"type": "string",
			"title": "Service Name",
			"minLength": 1,
			"description": "Service Name"
		},
		"identifier": {
			"type": "string",
			"title": "Service Identifier",
			"description": "Service URI if exists, otherwise the same of Service Id."
		},
		"issued": {
			"type": "string",
			"format": "date-time",
			"title": "Issued at",
			"description": "Timestamp of the Service creation."
		},
		"createdByUserId": {
			"type": "string",
			"title": "Created by User Id",
			"description": "User Id of Service Editor (e.g. Data Controller).",
			"minLength": 3
		},
		"serviceDescriptionVersion": {
			"type": "string",
			"title": "Service Description version",
			"description": "Service description version number."
		},
		"serviceDescriptionSignature": {
			"title": "Service Description Signature",
			"type": "string",
			"description": "JWS signature (signed with Service private key) of the Service Description"
		},
		"serviceIconUrl": {
			"type": "string",
			"title": "Service Icon Url",
			"description": "URL pointing to Service Icon file"
		},
		"status": {
			"type": "string",
			"title": "Service Description status",
			"description": "Status of Service Description (Allowed values: *Completed*, *Deprecated*, *UnderDevelopment*, *Withdrawn*)",
			"default": "Completed",
			"enum": [
				"Completed",
				"Deprecated",
				"UnderDevelopment",
				"WithDrawn"
			]
		},
		"supportedProfiles": {
			"type": "array",
			"title": "Supported profiles",
			"description": " Type of Data processing regulation profiles supported by the Service, according to My Data specification (Allowed values: *contract*, *consenting*, *3rd party re-use*, *notification*, *objection*)",
			"default": "Consenting",
			"items": {
				"type": "string",
				"format": "select",
				"enum": [
					"Contract",
					"Consenting",
					"3rd party re-use",
					"Notification",
					"Objection"
				]
			},
			"format": "select2",
			"uniqueItems": true
		},
		"spatial": {
			"title": "Spatial",
			"description": "Geographical Localization of Service",
			"type": "string",
			"format": "select2",
			"options": {
				"grid_columns": 12
			}
		},
		"lifeEvent": {
			"$ref": "./life_event.json"
		},
		"businessEvent": {
			"$ref": "./business_event.json"
		},
		"sector": {
			"$ref": "./sectors.json"
		},
		"type": {
			"$ref": "./types.json"
		},
		"thematicArea": {
			"$ref": "./thematic_area.json"
		},
		"language": {
			"$ref": "./locale.json"
		},
		"hasCompetentAuthority": {
			"title": "Competent Authority",
			"description": "If public Service, link to a Public Organization, which is the responsible Agent for the delivery of the Public Service.",
			"type": "object",
			"properties": {
				"prefLabel": {
					"type": "string",
					"title": "Preferred Label"
				},
				"spatial": {
					"$ref": "#/properties/spatial"
				}
			}
		},
		"humanReadableDescription": {
			"$ref": "#/definitions/humanReadableDescription"
		},
		"serviceInstance": {
			"$ref": "./service_instance.json"
		},
		"isDescribedAt": {
			"$ref": "./is_described_at.json"
		},
		"processingBases": {
			"type": "array",
			"title": "Data Processing Bases",
			"format": "tabs",
			"description": "It collects the different legal basis and requirements for personal data processing according to EU data protection Rules (Art. 6 GDPR). It describes describe different situations where a company or an organisation is allowed to collect or reuse your personal information: contract, legal obligation, vital interest, public interest, legitimate interest and consent",
			"items": {
				"$ref": "./processing_basis.json"
			}
		},
		"role": {
			"type": "string",
			"description": "Role that the Service will have in data processing and related Consents: Sink (Data Requester) or Source (Data Provider) ",
			"enum": [
				"Sink",
				"Source"
			]
		}
	}
}